tax_id,Org_name,GeneID,CurrentID,Status,Symbol,Aliases,description,other_designations,map_location,chromosome,genomic_nucleotide_accession.version,start_position_on_the_genomic_accession,end_position_on_the_genomic_accession,orientation,exon_count,OMIM
9606,Homo sapiens,3918,0,live,LAMC2,"B2T, BM600, CSF, EBR2, EBR2A, LAMB2T, LAMNB2",laminin subunit gamma 2,"laminin subunit gamma-2|BM600-100kDa|CSF 140 kDa subunit|cell-scattering factor 140 kDa subunit|epiligrin subunit gamma|kalinin subunit gamma|ladsin 140 kDa subunit|laminin B2t chain|laminin, gamma 2|large adhesive scatter factor 140 kDa subunit|nicein subunit gamma",1q25.3,1,NC_000001.11,183186264,183245127,plus,23,150292
9606,Homo sapiens,6195,0,live,RPS6KA1,"HU-1, MAPKAPK1, MAPKAPK1A, RSK, RSK1, p90Rsk",ribosomal protein S6 kinase A1,"ribosomal protein S6 kinase alpha-1|90 kDa ribosomal protein S6 kinase 1|MAP kinase-activated protein kinase 1a|MAPK-activated protein kinase 1a|MAPKAP kinase 1a|MAPKAPK-1a|RSK-1|S6K-alpha 1|dJ590P13.1 (ribosomal protein S6 kinase, 90kD, polypeptide 1)|p90-RSK 1|p90RSK1|p90S6K|ribosomal S6 kinase 1|ribosomal protein S6 kinase, 90kDa, polypeptide 1",1p36.11,1,NC_000001.11,26529761,26575028,plus,25,601684
9606,Homo sapiens,5605,0,live,MAP2K2,"CFC4, MAPKK2, MEK2, MKK2, PRKMK2",mitogen-activated protein kinase kinase 2,"dual specificity mitogen-activated protein kinase kinase 2|ERK activator kinase 2|MAP kinase kinase 2|MAPK/ERK kinase 2|mitogen-activated protein kinase kinase 2, p45",19p13.3,19,NC_000019.10,4090321,4124184,minus,13,601263
9606,Homo sapiens,3248,0,live,HPGD,"15-PGDH, PGDH, PGDH1, PHOAR1, SDR36C1",15-hydroxyprostaglandin dehydrogenase,15-hydroxyprostaglandin dehydrogenase [NAD()]|15-hydroxyprostaglandin dehydrogenase (NAD())|NAD+dependent 15-hydroxyprostaglandin dehydrogenase|hydroxyprostaglandin dehydrogenase 15-(NAD)|prostaglandin dehydrogenase 1|short chain dehydrogenase/reductase family 36C member 1,4q34.1,4,NC_000004.12,174490175,174522898,minus,10,601688
9606,Homo sapiens,835,0,live,CASP2,"CASP-2, ICH1, NEDD-2, NEDD2, PPP1R57",caspase 2,"caspase-2|caspase 2 apoptosis-related cysteine peptidase|neural precursor cell expressed developmentally down-regulated protein 2|protease ICH-1|protein phosphatase 1, regulatory subunit 57",7q34,7,NC_000007.14,143288351,143307696,plus,13,600639
9606,Homo sapiens,406934,0,live,MIR142,"MIRN142, mir-142",microRNA 142,hsa-mir-142,17q22,17,NC_000017.11,58331232,58331318,minus,1,615657
9606,Homo sapiens,8915,0,live,BCL10,"CARMEN, CIPER, CLAP, IMD37, c-E10, mE10",BCL10 immune signaling adaptor,B-cell lymphoma/leukemia 10|B cell CLL/lymphoma 10|CARD containing molecule enhancing NF-kB|CARD-containing apoptotic signaling protein|CARD-containing molecule enhancing NF-kappa-B|CARD-containing proapoptotic protein|CED-3/ICH-1 prodomain homologous E10-like regulator|cCARMEN|caspase-recruiting domain-containing protein|cellular homolog of vCARMEN|cellular-E10|hCLAP|mammalian CARD-containing adapter molecule E10,1p22.3,1,NC_000001.11,85265776,85276632,minus,5,603517
9606,Homo sapiens,2277,0,live,VEGFD,"FIGF, VEGF-D",vascular endothelial growth factor D,vascular endothelial growth factor D|c-fos induced growth factor (vascular endothelial growth factor D),Xp22.2,X,NC_000023.11,15345596,15384413,minus,7,300091
9606,Homo sapiens,5338,0,live,PLD2,PLD1C,phospholipase D2,phospholipase D2|choline phosphatase 2|phosphatidylcholine-hydrolyzing phospholipase D2,17p13.2,17,NC_000017.11,4807152,4823432,plus,25,602384
9606,Homo sapiens,5660,0,live,PSAP,"GLBA, SAP1, SAP2",prosaposin,prosaposin|proactivator polypeptide|saposin-A|saposin-B|saposin-C|saposin-D|sphingolipid activator protein-1|sphingolipid activator protein-2,10q22.1,10,NC_000010.11,71816298,71851251,minus,15,176801
9606,Homo sapiens,11197,0,live,WIF1,WIF-1,WNT inhibitory factor 1,wnt inhibitory factor 1,12q14.3,12,NC_000012.12,65050626,65121305,minus,10,605186
9606,Homo sapiens,10481,0,live,HOXB13,"HPC9, PSGD",homeobox B13,homeobox protein Hox-B13,17q21.32,17,NC_000017.11,48724763,48728750,minus,2,604607
9606,Homo sapiens,5730,0,live,PTGDS,"L-PGDS, LPGDS, PDS, PGD2, PGDS, PGDS2",prostaglandin D2 synthase,prostaglandin-H2 D-isomerase|PGD2 synthase|beta-trace protein|cerebrin-28|glutathione-independent PGD synthase|glutathione-independent PGD synthetase|lipocalin-type prostaglandin D synthase|prostaglandin D synthase|prostaglandin D2 synthase 21kDa (brain)|testis tissue sperm-binding protein Li 63n,9q34.3,9,NC_000009.12,136977504,136981742,plus,7,176803
9606,Homo sapiens,5592,0,live,PRKG1,"AAT8, PKG, PKG1B, PRKGR1B, cGK, cGK 1, cGK1, cGKI, cGKI-BETA, cGKI-alpha, PRKG1",protein kinase cGMP-dependent 1,"cGMP-dependent protein kinase 1|protein kinase, cGMP-dependent, regulatory, type I, beta|protein kinase, cGMP-dependent, type I",10q11.23-q21.1,10,NC_000010.11,50990888,52298350,plus,23,176894
9606,Homo sapiens,7113,0,live,TMPRSS2,"PP9284, PRSS10",transmembrane serine protease 2,"transmembrane protease serine 2|epitheliasin|serine protease 10|transmembrane protease, serine 2",21q22.3,21,NC_000021.9,41464305,41508158,minus,15,602060
9606,Homo sapiens,4739,0,live,NEDD9,"CAS-L, CAS2, CASL, CASS2, HEF1","neural precursor cell expressed, developmentally down-regulated 9",enhancer of filamentation 1|Cas scaffolding protein family member 2|Crk-associated substrate related protein Cas-L|Enhancer of filamentation 1 p55|cas-like docking|neural precursor cell expressed developmentally down-regulated protein 9|p130Cas-related protein|renal carcinoma antigen NY-REN-12,6p24.2,6,NC_000006.12,11183298,11382348,minus,11,602265
9606,Homo sapiens,406987,0,live,MIR204,"MIRN204, RDICC, miRNA204, mir-204",microRNA 204,hsa-mir-204,9q21.12,9,NC_000009.12,70809975,70810084,minus,1,610942
9606,Homo sapiens,55000,0,live,TUG1,"LINC00080, NCRNA00080, TI-227H",taurine up-regulated 1,TUG1 noncoding RNA|long intergenic non-protein coding RNA 80|taurine up-regulated 1 (non-protein coding)|taurine upregulated gene 1,22q12.2,22,NC_000022.11,30969211,30979395,plus,4,614971
9606,Homo sapiens,5062,0,live,PAK2,"PAK65, PAKgamma",p21 (RAC1) activated kinase 2,serine/threonine-protein kinase PAK 2|PAK-2|S6/H4 kinase|gamma-PAK|p21 (CDKN1A)-activated kinase 2|p21 protein (Cdc42/Rac)-activated kinase 2|p21-activated kinase 2|p58,3q29,3,NC_000003.12,196739857,196832647,plus,16,605022
9606,Homo sapiens,90,0,live,ACVR1,"ACTRIA, ACVRLK2, ALK2, FOP, SKR1, TSRI, ACVR1",activin A receptor type 1,"activin receptor type-1|TGF-B superfamily receptor type I|activin A receptor, type I|activin A receptor, type II-like kinase 2|activin receptor type I|activin receptor-like kinase 2|hydroxyalkyl-protein kinase|serine/threonine-protein kinase receptor R1",2q24.1,2,NC_000002.12,157736446,157876330,minus,16,102576
9606,Homo sapiens,10644,0,live,IGF2BP2,"IMP-2, IMP2, VICKZ2",insulin like growth factor 2 mRNA binding protein 2,insulin-like growth factor 2 mRNA-binding protein 2|IGF-II mRNA-binding protein 2|IGF2 mRNA-binding protein 2|VICKZ family member 2,3q27.2,3,NC_000003.12,185643130,185825046,minus,24,608289
9606,Homo sapiens,6768,0,live,ST14,"ARCI11, HAI, MT-SP1, MTSP1, PRSS14, SNC19, TADG15, TMPRSS14",suppression of tumorigenicity 14,"suppressor of tumorigenicity 14 protein|membrane-type serine protease 1|prostamin|serine protease 14|serine protease TADG-15|suppression of tumorigenicity 14 (colon carcinoma)|suppression of tumorigenicity 14 (colon carcinoma, matriptase, epithin)|tumor associated differentially expressed gene 15 protein",11q24.3,11,NC_000011.10,130159782,130210362,plus,19,606797
9606,Homo sapiens,9641,0,live,IKBKE,"IKK-E, IKK-i, IKKE, IKKI",inhibitor of nuclear factor kappa B kinase subunit epsilon,"inhibitor of nuclear factor kappa-B kinase subunit epsilon|I-kappa-B kinase epsilon|IKK-epsilon|IKK-related kinase epsilon|inducible I kappa-B kinase|inducible IkappaB kinase|inhibitor of kappa light polypeptide gene enhancer in B-cells, kinase epsilon",1q32.1,1,NC_000001.11,206470243,206496890,plus,22,605048
9606,Homo sapiens,406,0,live,ARNTL,"BMAL1, BMAL1c, JAP3, MOP3, PASD3, TIC, bHLHe5",aryl hydrocarbon receptor nuclear translocator like,"aryl hydrocarbon receptor nuclear translocator-like protein 1|ARNT-like protein 1, brain and muscle|PAS domain containing 3|PAS domain-containing protein 3|bHLH-PAS protein JAP3|basic helix-loop-helix family member e5|basic-helix-loop-helix-PAS orphan MOP3|basic-helix-loop-helix-PAS protein MOP3|brain and muscle ARNT-like 1|class E basic helix-loop-helix protein 5|member of PAS protein 3|member of PAS superfamily 3|testis tissue sperm-binding protein Li 50e",11p15.3,11,NC_000011.10,13276552,13387268,plus,25,602550
9606,Homo sapiens,8864,0,live,PER2,"FASPS, FASPS1",period circadian regulator 2,period circadian protein homolog 2|circadian clock protein PERIOD 2|hPER2|period 2|period circadian clock 2|period circadian protein 2|period homolog 2,2q37.3,2,NC_000002.12,238244038,238290102,minus,25,603426
9606,Homo sapiens,1058,0,live,CENPA,"CENP-A, CenH3",centromere protein A,"histone H3-like centromeric protein A|centromere autoantigen A|centromere protein A, 17kDa|centromere-specific histone",2p23.3,2,NC_000002.12,26786015,26794589,plus,5,117139
9606,Homo sapiens,406976,0,live,MIR199A1,"MIR-199-s, MIRN199A1, mir-199a-1",microRNA 199a-1,hsa-mir-199a-1|miR-199a-3p,19p13.2,19,NC_000019.10,10817426,10817496,minus,1,610719
9606,Homo sapiens,5971,0,live,RELB,"I-REL, IMD53, IREL, REL-B","RELB proto-oncogene, NF-kB subunit","transcription factor RelB|v-rel avian reticuloendotheliosis viral oncogene homolog B (nuclear factor of kappa light polypeptide gene enhancer in B-cells 3)|v-rel reticuloendotheliosis viral oncogene homolog B, nuclear factor of kappa light polypeptide gene enhancer in B-cells 3",19q13.32,19,NC_000019.10,45001449,45038194,plus,12,604758
9606,Homo sapiens,5564,0,live,PRKAB1,"AMPK, HAMPKb",protein kinase AMP-activated non-catalytic subunit beta 1,"5'-AMP-activated protein kinase subunit beta-1|5'-AMP-activated protein kinase beta-1 subunit|AMP-activated protein kinase beta subunit|AMPK beta -1 chain|AMPK beta 1|AMPK subunit beta-1|AMPKb|protein kinase, AMP-activated, beta 1 non-catalytic subunit|protein kinase, AMP-activated, noncatalytic, beta-1",12q24.23,12,NC_000012.12,119667864,119681624,plus,8,602740
9606,Homo sapiens,7222,0,live,TRPC3,"SCA41, TRP3",transient receptor potential cation channel subfamily C member 3,short transient receptor potential channel 3|hTrp-3|transient receptor potential cation channel subfamily C member 3 variant c|transient receptor protein 3,4q27,4,NC_000004.12,121874481,121952060,minus,13,602345
9606,Homo sapiens,1001,0,live,CDH3,"CDHP, HJMD, PCAD",cadherin 3,"cadherin-3|cadherin 3, type 1, P-cadherin (placental)|calcium-dependent adhesion protein, placental",16q22.1,16,NC_000016.10,68644914,68727573,plus,18,114021
9606,Homo sapiens,7334,0,live,UBE2N,"HEL-S-71, UBC13, UBCHBEN; UBC13, UbcH-ben, UbcH13",ubiquitin conjugating enzyme E2 N,"ubiquitin-conjugating enzyme E2 N|E2 ubiquitin-conjugating enzyme N|bendless-like ubiquitin conjugating enzyme|epididymis secretory protein Li 71|ubiquitin carrier protein N|ubiquitin conjugating enzyme E2N|ubiquitin-conjugating enzyme E2N (UBC13 homolog, yeast)|ubiquitin-conjugating enzyme E2N (homologous to yeast UBC13)|ubiquitin-protein ligase N|yeast UBC13 homolog",12q22,12,NC_000012.12,93405684,93442336,minus,4,603679
9606,Homo sapiens,406941,0,live,MIR149,"MIRN149, mir-149",microRNA 149,hsa-mir-149,2q37.3,2,NC_000002.12,240456001,240456089,plus,1,615209
9606,Homo sapiens,9846,0,live,GAB2,,GRB2 associated binding protein 2,GRB2-associated-binding protein 2|Grb2-associated binder 2|growth factor receptor bound protein 2-associated protein 2|pp100,11q14.1,11,NC_000011.10,78215290,78417820,minus,14,606203
9606,Homo sapiens,8061,0,live,FOSL1,"FRA, FRA1, fra-1","FOS like 1, AP-1 transcription factor subunit","fos-related antigen 1|FOS like 1, AP-1 trancription factor subunit|FOS-like antigen-1",11q13.1,11,NC_000011.10,65892049,65900526,minus,5,136515
9606,Homo sapiens,2796,0,live,GNRH1,"GNRH, GRH, LHRH, LNRH",gonadotropin releasing hormone 1,progonadoliberin-1|GnRH-associated peptide 1|gonadotropin-releasing hormone 1 (luteinizing-releasing hormone)|leuteinizing-releasing hormone|luliberin I|prolactin release-inhibiting factor,8p21.2,8,NC_000008.11,25419258,25425040,minus,3,152760
9606,Homo sapiens,6623,0,live,SNCG,"BCSG1, SR",synuclein gamma,"gamma-synuclein|-synuclein|E pound-synuclein|breast cancer-specific gene 1 protein|persyn|synoretin|synuclein, gamma (breast cancer-specific protein 1)",10q23.2,10,NC_000010.11,86955759,86963260,plus,7,602998
9606,Homo sapiens,3170,0,live,FOXA2,"HNF3B, TCF3B",forkhead box A2,hepatocyte nuclear factor 3-beta|HNF-3-beta|HNF-3B|TCF-3B|forkhead box protein A2|hepatic nuclear factor-3-beta|transcription factor 3B,20p11.21,20,NC_000020.11,22580998,22585490,minus,3,600288
9606,Homo sapiens,1630,0,live,DCC,"CRC18, CRCR1, HGPPS2, IGDCC1, MRMV1, NTN1R1",DCC netrin 1 receptor,netrin receptor DCC|colorectal cancer suppressor|deleted in colorectal carcinoma|immunoglobulin superfamily DCC subclass member 1|putative colorectal tumor suppressor|tumor suppressor protein DCC,18q21.2,18,NC_000018.10,52340172,53535899,plus,32,120470
9606,Homo sapiens,1495,0,live,CTNNA1,"CAP102, MDPT2",catenin alpha 1,"catenin alpha-1|alpha-E-catenin|catenin (cadherin-associated protein), alpha 1, 102kDa|epididymis secretory sperm binding protein|renal carcinoma antigen NY-REN-13",5q31.2,5,NC_000005.10,138753386,138935034,plus,27,116805
9606,Homo sapiens,5732,0,live,PTGER2,EP2,prostaglandin E receptor 2,"prostaglandin E2 receptor EP2 subtype|PGE receptor EP2 subtype|PGE2 receptor EP2 subtype|prostaglandin E receptor 2 (subtype EP2), 53kD|prostaglandin E receptor 2 (subtype EP2), 53kDa|prostanoid EP2 receptor",14q22.1,14,NC_000014.9,52314312,52328598,plus,2,176804
9606,Homo sapiens,10801,0,live,SEPTIN9,"AF17q25, MSF, MSF1, NAPB, PNUTL4, SEPT9, SINT1, SeptD1",septin 9,septin-9|MLL septin-like fusion protein MSF-A|Ov/Br septin|ovarian/breast septin|septin D1,17q25.3,17,NC_000017.11,77281499,77500596,plus,21,604061
9606,Homo sapiens,6277,0,live,S100A6,"2A9, 5B10, CABP, CACY, PRA, S10A6",S100 calcium binding protein A6,protein S100-A6|MLN 4|calcyclin|growth factor-inducible protein 2A9|prolactin receptor-associated protein,1q21.3,1,NC_000001.11,153534599,153536049,minus,3,114110
9606,Homo sapiens,3426,0,live,CFI,"AHUS3, ARMD13, C3BINA, C3b-INA, FI, IF, KAF",complement factor I,complement factor I|C3B/C4B inactivator|C3b-inactivator|Konglutinogen-activating factor|complement component I|complement control protein factor I|complement factor I heavy chain|light chain of factor I,4q25,4,NC_000004.12,109730982,109802225,minus,17,217030
9606,Homo sapiens,9020,0,live,MAP3K14,"FTDCR1B, HS, HSNIK, NIK",mitogen-activated protein kinase kinase kinase 14,mitogen-activated protein kinase kinase kinase 14|NF-kappa-beta-inducing kinase|serine/threonine-protein kinase NIK,17q21.31,17,NC_000017.11,45263119,45317048,minus,17,604655
9606,Homo sapiens,23213,0,live,SULF1,SULF-1,sulfatase 1,extracellular sulfatase Sulf-1|sulfatase FP,8q13.2-q13.3,8,NC_000008.11,69466624,69660912,plus,26,610012
9606,Homo sapiens,8313,0,live,AXIN2,"AXIL, ODCRCS",axin 2,axin-2|axin-like protein|axis inhibition protein 2|conductin,17q24.1,17,NC_000017.11,65528563,65561648,minus,15,604025
9606,Homo sapiens,990,0,live,CDC6,"CDC18L, HsCDC18, HsCDC6, MGORS5",cell division cycle 6,cell division control protein 6 homolog|CDC6 cell division cycle 6 homolog|CDC6-related protein|cdc18-related protein|cell division cycle 6 homolog|p62(cdc6),17q21.2,17,NC_000017.11,40287878,40304657,plus,13,602627
9606,Homo sapiens,79648,0,live,MCPH1,"BRIT1, MCT",microcephalin 1,microcephalin|BRCT-repeat inhibitor of TERT expression 1|truncated microcephalin,8p23.1,8,NC_000008.11,6406592,6648508,plus,23,607117
9606,Homo sapiens,6019,0,live,RLN2,"H2, H2-RLX, RLXH2, bA12D24.1.1, bA12D24.1.2",relaxin 2,"prorelaxin H2|H2-preprorelaxin|relaxin H2|relaxin, ovarian, of pregnancy",9p24.1,9,NC_000009.12,5299864,5339438,minus,9,179740
9606,Homo sapiens,657,0,live,BMPR1A,"10q23del, ACVRLK3, ALK3, CD292, SKR5",bone morphogenetic protein receptor type 1A,"bone morphogenetic protein receptor type-1A|ALK-3|BMP type-1A receptor|BMPR-1A|activin A receptor, type II-like kinase 3|activin receptor-like kinase 3|bone morphogenetic protein receptor, type IA|serine/threonine-protein kinase receptor R5",10q23.2,10,NC_000010.11,86755786,86927969,plus,15,601299
9606,Homo sapiens,9961,0,live,MVP,"LRP, VAULT1",major vault protein,major vault protein|lung resistance-related protein|testicular secretory protein Li 30,16p11.2,16,NC_000016.10,29820394,29848039,plus,15,605088
9606,Homo sapiens,824,0,live,CAPN2,"CANP2, CANPL2, CANPml, mCANP",calpain 2,"calpain-2 catalytic subunit|CANP 2|M-calpain|calcium-activated neutral proteinase 2|calpain 2, (m/II) large subunit|calpain 2, large [catalytic] subunit|calpain 2, large subunit|calpain M-type|calpain, large polypeptide L2|millimolar-calpain",1q41,1,NC_000001.11,223701593,223776018,plus,22,114230
9606,Homo sapiens,7516,0,live,XRCC2,FANCU,X-ray repair cross complementing 2,DNA repair protein XRCC2|X-ray repair complementing defective repair in Chinese hamster cells 2|X-ray repair cross-complementing protein 2|epididymis secretory sperm binding protein,7q36.1,7,NC_000007.14,152644776,152676141,minus,3,600375
9606,Homo sapiens,201163,0,live,FLCN,"BHD, DENND8B, FLCL",folliculin,folliculin|BHD skin lesion fibrofolliculoma protein|birt-Hogg-Dube syndrome protein,17p11.2,17,NC_000017.11,17206946,17237188,minus,18,607273
9606,Homo sapiens,7170,0,live,TPM3,"CAPM1, CFTD, HEL-189, HEL-S-82p, NEM1, OK/SW-cl.5, TM-5, TM3, TM30, TM30nm, TM5nu, TPMsk3, TRK, hscp30, TPM3",tropomyosin 3,"tropomyosin alpha-3 chain|alpha-tropomyosin, slow skeletal|cytoskeletal tropomyosin TM30|epididymis luminal protein 189|epididymis secretory sperm binding protein Li 82p|heat-stable cytoskeletal protein 30 kDa|tropomyosin 3 nu|tropomyosin gamma|tropomyosin-5",1q21.3,1,NC_000001.11,154155304,154192100,minus,16,191030
9606,Homo sapiens,407010,0,live,MIR23A,"MIRN23A, hsa-mir-23a, miRNA23A, mir-23a",microRNA 23a,,19p13.12,19,NC_000019.10,13836587,13836659,minus,1,607962
9606,Homo sapiens,406893,0,live,MIR101-1,"MIRN101-1, mir-101-1",microRNA 101-1,hsa-mir-101-1,1p31.3,1,NC_000001.11,65058434,65058508,minus,1,612511
9606,Homo sapiens,406979,0,live,MIR19A,"C13orf25, MIR17HG, MIRH1, MIRHG1, MIRN19A, hsa-mir-19a, miR-19a, miRNA19A",microRNA 19a,Putative microRNA 17 host gene protein|Putative microRNA host gene 1 protein,13q31.3,13,NC_000013.11,91350891,91350972,plus,1,609418
9606,Homo sapiens,1827,0,live,RCAN1,"ADAPT78, CSP1, DSC1, DSCR1, MCIP1, RCN1",regulator of calcineurin 1,calcipressin-1|Down syndrome candidate region 1|Down syndrome critical region gene 1|calcium and oxidant-inducible mRNA|modulatory calcineurin-interacting protein 1|myocyte-enriched calcineurin-interacting protein 1|near DSCR proline-rich protein,21q22.12,21,NC_000021.9,34516442,34615123,minus,9,602917
9606,Homo sapiens,7083,0,live,TK1,TK2,thymidine kinase 1,"thymidine kinase, cytosolic|cytosolic thymidine kinase|epididymis secretory sperm binding protein|thymidine kinase 1 soluble isoform",17q25.3,17,NC_000017.11,78174079,78187204,minus,6,188300
9606,Homo sapiens,389421,0,live,LIN28B,CSDD2,lin-28 homolog B,protein lin-28 homolog B|Lin-28.2|lin-28B,6q16.3-q21,6,NC_000006.12,104936999,105083332,plus,7,611044
9606,Homo sapiens,9588,0,live,PRDX6,"1-Cys, AOP2, HEL-S-128m, NSGPx, PRX, aiPLA2, p29",peroxiredoxin 6,peroxiredoxin-6|1-Cys PRX|1-Cys peroxiredoxin|24 kDa protein|acidic calcium-independent phospholipase A2|antioxidant protein 2|epididymis secretory sperm binding protein Li 128m|liver 2D page spot 40|non-selenium glutathione peroxidase|red blood cells page spot 12,1q25.1,1,NC_000001.11,173477335,173488815,plus,5,602316
9606,Homo sapiens,5893,0,live,RAD52,,"RAD52 homolog, DNA repair protein",DNA repair protein RAD52 homolog|recombination protein RAD52|rhabdomyosarcoma antigen MU-RMS-40.23,12p13.33,12,NC_000012.12,911028,991195,minus,18,600392
9606,Homo sapiens,2549,0,live,GAB1,DFNB26,GRB2 associated binding protein 1,"GRB2-associated-binding protein 1|GRB2-associated binder 1|deafness, autosomal recessive 26|growth factor receptor bound protein 2-associated protein 1|symbol withdrawn, see GAB1",4q31.21,4,NC_000004.12,143336876,143474565,plus,19,604439
9606,Homo sapiens,10642,0,live,IGF2BP1,"CRD-BP, CRDBP, IMP-1, IMP1, VICKZ1, ZBP1",insulin like growth factor 2 mRNA binding protein 1,insulin-like growth factor 2 mRNA-binding protein 1|IGF-II mRNA-binding protein 1|IGF2 mRNA-binding protein 1|VICKZ family member 1|ZBP-1|coding region determinant-binding protein|insulin-like growth factor 2 mRNA binding protein 1 deltaN CRDBP|zipcode-binding protein 1,17q21.32,17,NC_000017.11,48997385,49056145,plus,16,608288
9606,Homo sapiens,5873,0,live,RAB27A,"GS2, HsT18676, RAB27, RAM","RAB27A, member RAS oncogene family",ras-related protein Rab-27A|GTP-binding protein Ram|mutant Ras-related protein Rab-27A|rab-27,15q21.3,15,NC_000015.10,55202966,55291338,minus,12,603868
9606,Homo sapiens,3640,0,live,INSL3,"RLF, RLNL, ley-I-L",insulin like 3,insulin-like 3|insulin-like 3 (Leydig cell)|leydig insulin -like hormone|leydig insulin-like peptide|prepro-INSL3|relaxin-like factor b,19p13.11,19,NC_000019.10,17816512,17821519,minus,3,146738
9606,Homo sapiens,10298,0,live,PAK4,,p21 (RAC1) activated kinase 4,"serine/threonine-protein kinase PAK 4|p21 protein (Cdc42/Rac)-activated kinase 4|p21(CDKN1A)-activated kinase 4|protein kinase related to S. cerevisiae STE20, effector for Cdc42Hs",19q13.2,19,NC_000019.10,39125786,39182816,plus,14,605451
9606,Homo sapiens,3609,0,live,ILF3,"CBTF, DRBF, DRBP76, MMP4, MPHOSPH4, MPP4, MPP4110, NF-AT-90, NF110, NF110b, NF90, NF90a, NF90b, NF90c, NF90ctv, NFAR, NFAR-1, NFAR-2, NFAR110, NFAR2, NFAR90, TCP110, TCP80",interleukin enhancer binding factor 3,"interleukin enhancer-binding factor 3|M phase phosphoprotein 4, nuclear factor associated with DS RNA|M-phase phosphoprotein 4|double-stranded RNA-binding protein, 76 kD|dsRNA binding protein NFAR-2/MPP4|interleukin enhancer binding factor 3, 90kD|interleukin enhancer binding factor 3, 90kDa|nuclear factor associated with dsRNA|nuclear factor of activated T-cells 110 kDa|nuclear factor of activated T-cells 90 kDa|nuclear factor of activated T-cells, 90 kD|translational control protein 80",19p13.2,19,NC_000019.10,10654261,10692419,plus,23,603182
9606,Homo sapiens,4481,0,live,MSR1,"CD204, SCARA1, SR-A, SR-AI, SR-AII, SR-AIII, SRA, phSR1, phSR2",macrophage scavenger receptor 1,macrophage scavenger receptor types I and II|macrophage acetylated LDL receptor I and II|macrophage scavenger receptor type III|scavenger receptor class A member 1,8p22,8,NC_000008.11,16107878,16192791,minus,12,153622
9606,Homo sapiens,10747,0,live,MASP2,"MAP19, MASP-2, MASP1P1, sMAP",mannan binding lectin serine peptidase 2,mannan-binding lectin serine protease 2|MBL-associated plasma protein of 19 kD|MBL-associated serine protease 2|mannan-binding lectin serine peptidase 1 pseudogene 1|mannan-binding lectin serine protease 1 pseudogene 1|mannose-binding protein-associated serine protease 2|small MBL-associated protein,1p36.22,1,NC_000001.11,11026523,11047239,minus,12,605102
9606,Homo sapiens,407046,0,live,MIR9-1,"MIRN9-1, hsa-mir-9-1, miRNA9-1, mir-9-1",microRNA 9-1,,1q22,1,NC_000001.11,156420341,156420429,minus,1,611186
9606,Homo sapiens,6470,0,live,SHMT1,"CSHMT, SHMT",serine hydroxymethyltransferase 1,"serine hydroxymethyltransferase, cytosolic|cytoplasmic serine hydroxymethyltransferase|glycine hydroxymethyltransferase|serine hydroxymethyltransferase 1 (soluble)|serine methylase",17p11.2,17,NC_000017.11,18327860,18363563,minus,14,182144
9606,Homo sapiens,5653,0,live,KLK6,"Bssp, Klk7, PRSS18, PRSS9, SP59, hK6",kallikrein related peptidase 6,kallikrein-6|kallikrein 6|neurosin|protease M|serine protease 18|serine protease 9|zyme,19q13.41,19,NC_000019.10,50958631,50969598,minus,7,602652
9606,Homo sapiens,2771,0,live,GNAI2,"GIPB, H_LUCA15.1, H_LUCA16.1, GNAI2",G protein subunit alpha i2,"guanine nucleotide-binding protein G(i) subunit alpha-2|GTP-binding regulatory protein Gi alpha-2 chain|adenylate cyclase-inhibiting G alpha protein|guanine nucleotide binding protein (G protein), alpha inhibiting activity polypeptide 2|guanine nucleotide-binding protein G(i), alpha-2 subunit",3p21.31,3,NC_000003.12,50227068,50259362,plus,13,139360
9606,Homo sapiens,6495,0,live,SIX1,"BOS3, DFNA23, TIP39",SIX homeobox 1,homeobox protein SIX1|sine oculis homeobox homolog 1,14q23.1,14,NC_000014.9,60643421,60649489,minus,2,601205
9606,Homo sapiens,407050,0,live,MIR93,"MIRN9, MIRN93, hsa-mir-93, miR-93",microRNA 93,,7q22.1,7,NC_000007.14,100093768,100093847,minus,1,612984
9606,Homo sapiens,2220,0,live,FCN2,"EBP-37, FCNL, P35, ficolin-2",ficolin 2,ficolin-2|37 kDa elastin-binding protein|L-ficolin|collagen/fibrinogen domain-containing protein 2|ficolin (collagen/fibrinogen domain containing lectin) 2 (hucolin)|ficolin B|ficolin-beta|serum lectin p35,9q34.3,9,NC_000009.12,134864062,134890506,plus,9,601624
9606,Homo sapiens,406904,0,live,MIR1-1,"MIRN1-1, hsa-mir-1-1, miRNA1-1, mir-1-1",microRNA 1-1,,20q13.33,20,NC_000020.11,62554306,62554376,plus,1,609326
9606,Homo sapiens,1374,0,live,CPT1A,"CPT1, CPT1-L, L-CPT1",carnitine palmitoyltransferase 1A,"carnitine O-palmitoyltransferase 1, liver isoform|CPT I|CPTI-L|carnitine O-palmitoyltransferase I, liver isoform|carnitine palmitoyltransferase 1A (liver)|carnitine palmitoyltransferase I, liver",11q13.3,11,NC_000011.10,68754620,68844410,minus,22,600528
