tax_id,Org_name,GeneID,CurrentID,Status,Symbol,Aliases,description,other_designations,map_location,chromosome,genomic_nucleotide_accession.version,start_position_on_the_genomic_accession,end_position_on_the_genomic_accession,orientation,exon_count,OMIM
9606,Homo sapiens,10562,0,live,OLFM4,"GC1, GW112, OLM4, OlfD, UNQ362, bA209J19.1, hGC-1, hOLfD",olfactomedin 4,olfactomedin-4|G-CSF-stimulated clone 1 protein|antiapoptotic protein GW112,13q14.3,13,NC_000013.11,53028813,53052057,plus,5,614061
9606,Homo sapiens,57697,0,live,FANCM,"FAAP250, KIAA1596, POF15, SPGF28",FA complementation group M,Fanconi anemia group M protein|ATP-dependent RNA helicase FANCM|Fanconi anemia complementation group M|fanconi anemia-associated polypeptide of 250 kDa|protein Hef ortholog,14q21.2,14,NC_000014.9,45135930,45200890,plus,25,609644
9606,Homo sapiens,442908,0,live,MIR340,"MIRN340, hsa-mir-340, mir-340",microRNA 340,,5q35.3,5,NC_000005.10,180015303,180015397,minus,1,
9606,Homo sapiens,407028,0,live,MIR302A,"MIRN302, MIRN302A, hsa-mir-302, mir-302a",microRNA 302a,hsa-mir-302a|microRNA 302,4q25,4,NC_000004.12,112648183,112648251,minus,1,614596
9606,Homo sapiens,55165,0,live,CEP55,"C10orf3, CT111, MARCH, URCC6",centrosomal protein 55,centrosomal protein of 55 kDa|cancer/testis antigen 111|centrosomal protein 55kDa|up-regulated in colon cancer 6,10q23.33,10,NC_000010.11,93496612,93529094,plus,9,610000
9606,Homo sapiens,9043,0,live,SPAG9,"CT89, HLC-6, HLC4, HLC6, JIP-4, JIP4, JLP, PHET, PIG6",sperm associated antigen 9,C-Jun-amino-terminal kinase-interacting protein 4|JNK interacting protein|JNK/SAPK-associated protein|Max-binding protein|c-Jun NH2-terminal kinase-associated leucine zipper protein|cancer/testis antigen 89|human lung cancer oncogene 6 protein|lung cancer oncogene 4|mitogen-activated protein kinase 8-interacting protein 4|proliferation-inducing gene 6|protein highly expressed in testis|sperm associated antigen 9 variant 5|sperm surface protein|sunday driver 1,17q21.33,17,NC_000017.11,50962174,51120868,minus,34,605430
9606,Homo sapiens,5947,0,live,RBP1,"CRABP-I, CRBP, CRBP1, CRBPI, RBPC",retinol binding protein 1,"retinol-binding protein 1|CRBP-I|cellular retinol binding protein 1|cellular retinol-binding protein I|retinol-binding protein 1, cellular",3q23,3,NC_000003.12,139517438,139539742,minus,6,180260
9606,Homo sapiens,406962,0,live,MIR186,"MIRN186, miR-186",microRNA 186,hsa-mir-186,1p31.1,1,NC_000001.11,71067631,71067716,minus,1,
9606,Homo sapiens,79977,0,live,GRHL2,"BOM, DFNA28, ECTDS, PPCD4, TFCP2L3",grainyhead like transcription factor 2,grainyhead-like protein 2 homolog|brother of mammalian grainyhead|grainyhead-like 2|transcription factor CP2-like 3,8q22.3,8,NC_000008.11,101492439,101678104,plus,18,608576
9606,Homo sapiens,9821,0,live,RB1CC1,"ATG17, CC1, FIP200, PPP1R131",RB1 inducible coiled-coil 1,"RB1-inducible coiled-coil protein 1|200 kDa FAK family kinase-interacting protein|FAK family kinase-interacting protein of 200 kDa|phosphatase 1, regulatory subunit 131",8q11.23,8,NC_000008.11,52622458,52714466,minus,28,606837
9606,Homo sapiens,3373,0,live,HYAL1,"HYAL-1, LUCA1, MPS9, NAT6",hyaluronidase 1,hyaluronidase-1|hyaluronoglucosaminidase 1|luCa-1|lung carcinoma protein 1|plasma hyaluronidase|tumor suppressor LUCA-1,3p21.31,3,NC_000003.12,50299889,50312951,minus,6,607071
9606,Homo sapiens,64699,0,live,TMPRSS3,"DFNB10, DFNB8, ECHOS1, TADG12",transmembrane serine protease 3,"transmembrane protease serine 3|serine protease TADG-12|transmembrane protease, serine 3|tumor-associated differentially-expressed gene 12 protein",21q22.3,21,NC_000021.9,42371837,42396052,minus,13,605511
9606,Homo sapiens,51701,0,live,NLK,,nemo like kinase,serine/threonine-protein kinase NLK,17q11.2,17,NC_000017.11,28042647,28205140,plus,13,609476
9606,Homo sapiens,124540,0,live,MSI2,MSI2H,musashi RNA binding protein 2,RNA-binding protein Musashi homolog 2|musashi homolog 2|musashi-2,17q22,17,NC_000017.11,57255851,57684689,plus,20,607897
9606,Homo sapiens,8936,0,live,WASF1,"NEDALVS, SCAR1, WAVE, WAVE1",WASP family member 1,wiskott-Aldrich syndrome protein family member 1|WAS protein family member 1|WASP family protein member 1|homology of dictyostelium scar 1|protein WAVE-1|verprolin homology domain-containing protein 1,6q21,6,NC_000006.12,110099819,110180004,minus,11,605035
9606,Homo sapiens,2020,0,live,EN2,,engrailed homeobox 2,homeobox protein engrailed-2|engrailed homolog 2|engrailed-2|homeobox protein en-2|hu-En-2,7q36.3,7,NC_000007.14,155458129,155464831,plus,2,131310
9606,Homo sapiens,5927,0,live,KDM5A,"RBBP-2, RBBP2, RBP2",lysine demethylase 5A,"lysine-specific demethylase 5A|Jumonji, AT rich interactive domain 1A (RBP2-like)|histone demethylase JARID1A|jumonji/ARID domain-containing protein 1A|lysine (K)-specific demethylase 5A|retinoblastoma binding protein 2",12p13.33,12,NC_000012.12,280057,389320,minus,28,180202
9606,Homo sapiens,1831,0,live,TSC22D3,"DIP, DSIPI, GILZ, TSC-22R",TSC22 domain family member 3,TSC22 domain family protein 3|DSIP-immunoreactive leucine zipper protein|DSIP-immunoreactive peptide|TSC-22 related protein|TSC-22-like protein|delta sleep-inducing peptide immunoreactor|glucocorticoid-induced leucine zipper protein,Xq22.3,X,NC_000023.11,107713221,107777329,minus,8,300506
9606,Homo sapiens,94234,0,live,FOXQ1,HFH1,forkhead box Q1,forkhead box protein Q1|HFH-1|HNF-3/forkhead-like protein 1|hepatocyte nuclear factor 3 forkhead homolog 1|winged helix/forkhead transcription factor,6p25.3,6,NC_000006.12,1312098,1314758,plus,1,612788
9606,Homo sapiens,51720,0,live,UIMC1,"RAP80, X2HRIP110",ubiquitin interaction motif containing 1,BRCA1-A complex subunit RAP80|receptor-associated protein 80|retinoid X receptor-interacting protein 110,5q35.2,5,NC_000005.10,176905005,177022640,minus,22,609433
9606,Homo sapiens,2889,0,live,RAPGEF1,"C3G, GRF2",Rap guanine nucleotide exchange factor 1,rap guanine nucleotide exchange factor 1|CRK SH3-binding GNRP|Rap guanine nucleotide exchange factor (GEF) 1|guanine nucleotide-releasing factor 2 (specific for crk proto-oncogene),9q34.13,9,NC_000009.12,131576770,131740068,minus,36,600303
9606,Homo sapiens,8569,0,live,MKNK1,MNK1,MAPK interacting serine/threonine kinase 1,MAP kinase-interacting serine/threonine-protein kinase 1|MAP kinase interacting serine/threonine kinase 1|MAP kinase signal-integrating kinase 1|MAPK signal-integrating kinase 1,1p33,1,NC_000001.11,46557407,46604311,minus,17,606724
9606,Homo sapiens,574455,0,live,MIR193B,"MIRN193B, mir-193b",microRNA 193b,hsa-mir-193b,16p13.12,16,NC_000016.10,14303967,14304049,plus,1,614734
9606,Homo sapiens,56413,0,live,LTB4R2,"BLT2, BLTR2, JULF2, KPG_004, LTB4-R 2, LTB4-R2, NOP9",leukotriene B4 receptor 2,leukotriene B4 receptor 2|LTB4 receptor JULF2|leukotriene B4 receptor BLT2|seven transmembrane receptor BLTR2,14q12,14,NC_000014.9,24310140,24312053,plus,2,605773
9606,Homo sapiens,1793,0,live,DOCK1,"DOCK180, ced5",dedicator of cytokinesis 1,dedicator of cytokinesis protein 1|180 kDa protein downstream of CRK|DOwnstream of CrK,10q26.2,10,NC_000010.11,126905409,127452517,plus,56,601403
9606,Homo sapiens,8824,0,live,CES2,"CE-2A1, PCE-2, iCE, CES2",carboxylesterase 2,"cocaine esterase|carboxylesterase 2 (intestine, liver)|intestinal carboxylesterase; liver carboxylesterase-2|methylumbelliferyl-acetate deacetylase 2",16q22.1,16,NC_000016.10,66934471,66945096,plus,12,605278
9606,Homo sapiens,28987,0,live,NOB1,"ART-4, MST158, MSTP158P, PSMD8BP1, NOB1",NIN1 (RPN12) binding protein 1 homolog,RNA-binding protein NOB1|NIN1/PSMD8 binding protein 1 homolog|PSMD8 binding protein 1|adenocarcinoma antigen recognized by T lymphocytes 4|nin one binding protein|phosphorylation regulatory protein HP-10|protein ART-4,16q22.1,16,NC_000016.10,69741854,69754968,minus,9,613586
9606,Homo sapiens,2817,0,live,GPC1,glypican,glypican 1,glypican-1|epididymis secretory sperm binding protein|glypican proteoglycan 1,2q37.3,2,NC_000002.12,240435663,240468076,plus,10,600395
9606,Homo sapiens,406925,0,live,MIR135A1,"MIRN135-1, MIRN135A1, mir-135a-1",microRNA 135a-1,hsa-mir-135-1|hsa-mir-135a-1|microRNA 135-1,3p21.2,3,NC_000003.12,52294219,52294308,minus,1,
9606,Homo sapiens,693175,0,live,MIR590,"MIRN590, hsa-mir-590, mir-590",microRNA 590,,7q11.23,7,NC_000007.14,74191198,74191294,plus,1,615070
9606,Homo sapiens,6434,0,live,TRA2B,"Htra2-beta, PPP1R156, SFRS10, SRFS10, TRA2-BETA, TRAN2B",transformer 2 beta homolog,"transformer-2 protein homolog beta|TRA-2 beta|protein phosphatase 1, regulatory subunit 156|splicing factor, arginine/serine-rich 10 (transformer 2 homolog, Drosophila)|transformer-2 protein homolog B",3q27.2,3,NC_000003.12,185914558,185938027,minus,10,602719
9606,Homo sapiens,5364,0,live,PLXNB1,"PLEXIN-B1, PLXN5, SEP",plexin B1,plexin-B1|plexin 5|semaphorin receptor SEP,3p21.31,3,NC_000003.12,48403854,48430324,minus,44,601053
9606,Homo sapiens,6491,0,live,STIL,"MCPH7, SIL",STIL centriolar assembly protein,SCL-interrupting locus protein|SCL/TAL1 interrupting locus|TAL-1-interrupting locus protein,1p33,1,NC_000001.11,47250139,47314787,minus,21,181590
9606,Homo sapiens,7915,0,live,ALDH5A1,"SSADH, SSDH",aldehyde dehydrogenase 5 family member A1,"succinate-semialdehyde dehydrogenase, mitochondrial|NAD()-dependent succinic semialdehyde dehydrogenase|mitochondrial succinate semialdehyde dehydrogenase",6p22.3,6,NC_000006.12,24494969,24537207,plus,11,610045
9606,Homo sapiens,2041,0,live,EPHA1,"EPH, EPHT, EPHT1",EPH receptor A1,ephrin type-A receptor 1|eph tyrosine kinase 1|erythropoietin-producing hepatoma amplified sequence|erythropoietin-producing hepatoma receptor|hEpha1|oncogene EPH|soluble EPHA1 variant 1|soluble EPHA1 variant 2|tyrosine-protein kinase receptor EPH,7q34-q35,7,NC_000007.14,143390813,143408865,minus,18,179610
9606,Homo sapiens,10036,0,live,CHAF1A,"CAF-1, CAF1, CAF1B, CAF1P150, P150",chromatin assembly factor 1 subunit A,chromatin assembly factor 1 subunit A|CAF-1 subunit A|CAF-I 150 kDa subunit|CAF-I p150|CTB-50L17.7|chromatin assembly factor I (150 kDa)|chromatin assembly factor I p150 subunit|hp150,19p13.3,19,NC_000019.10,4402596,4448322,plus,18,601246
9606,Homo sapiens,84441,0,live,MAML2,"MAM-3, MAM2, MAM3, MLL-MAML2",mastermind like transcriptional coactivator 2,mastermind-like protein 2|mam-2|mastermind-like 2,11q21,11,NC_000011.10,95976598,96343308,minus,7,607537
9606,Homo sapiens,7965,0,live,AIMP2,"HLD17, JTV-1, JTV1, P38",aminoacyl tRNA synthetase complex interacting multifunctional protein 2,aminoacyl tRNA synthase complex-interacting multifunctional protein 2|ARS-interacting multi-functional protein 2|multisynthase complex auxiliary component p38|multisynthetase complex auxiliary component p38|protein JTV-1,7p22.1,7,NC_000007.14,6009245,6023834,plus,9,600859
9606,Homo sapiens,793,0,live,CALB1,"CALB, D-28K",calbindin 1,"calbindin|RTVL-H protein|calbindin 1, (28kD)|calbindin 1, 28kDa|calbindin 27|calbindin D28|vitamin D-dependent calcium-binding protein, avian-type",8q21.3,8,NC_000008.11,90058608,90082879,minus,11,114050
9606,Homo sapiens,406924,0,live,MIR134,"MIRN134, mir-134",microRNA 134,hsa-mir-134,14q32.31,14,NC_000014.9,101054687,101054759,plus,1,610164
9606,Homo sapiens,51773,0,live,RSF1,"HBXAP, RSF-1, XAP8, p325",remodeling and spacing factor 1,remodeling and spacing factor 1|HBV pX-associated protein 8|hepatitis B virus x-associated protein|p325 subunit of RSF chromatin-remodeling complex,11q14.1,11,NC_000011.10,77660009,77872232,minus,17,608522
9606,Homo sapiens,119391,0,live,GSTO2,"GSTO 2-2, bA127L20.1",glutathione S-transferase omega 2,glutathione S-transferase omega-2|GSTO-2|MMA(V) reductase|bA127L20.1 (novel glutathione-S-transferase)|glutathione S-transferase omega 2-2|glutathione-S-transferase-like protein|glutathione-dependent dehydroascorbate reductase|monomethylarsonic acid reductase,10q25.1,10,NC_000010.11,104267626,104304950,plus,9,612314
9606,Homo sapiens,57111,0,live,RAB25,"CATX-8, RAB11C","RAB25, member RAS oncogene family",ras-related protein Rab-25,1q22,1,NC_000001.11,156061160,156070504,plus,5,612942
9606,Homo sapiens,3001,0,live,GZMA,"CTLA3, HFSP",granzyme A,"granzyme A|CTL tryptase|Cytotoxic T-lymphocyte-associated serine esterase-3|Granzyme A (Cytotoxic T-lymphocyte-associated serine esterase-3; Hanukah factor serine protease)|HF|Hanukah factor serine protease)|cytotoxic T-lymphocyte proteinase 1|fragmentin-1|granzyme 1|granzyme A (granzyme 1, cytotoxic T-lymphocyte-associated serine esterase 3)|h factor",5q11.2,5,NC_000005.10,55102646,55110252,plus,5,140050
9606,Homo sapiens,687,0,live,KLF9,"BTEB, BTEB1",Kruppel like factor 9,Krueppel-like factor 9|BTE-binding protein 1|GC-box-binding protein 1|basic transcription element-binding protein 1|transcription factor BTEB1,9q21.12,9,NC_000009.12,70384597,70414657,minus,2,602902
9606,Homo sapiens,1748,0,live,DLX4,"BP1, DLX7, DLX8, DLX9, OFC15",distal-less homeobox 4,homeobox protein DLX-4|beta protein 1|distal-less homeo box 7|distal-less homeo box 9|homeobox protein DLX-7|homeobox protein DLX-8,17q21.33,17,NC_000017.11,49968970,49974959,plus,4,601911
9606,Homo sapiens,406977,0,live,MIR199A2,"MIR-199-s, MIRN199A2, mir-199a-2",microRNA 199a-2,hsa-mir-199a-2|miR-199a-3p,1q24.3,1,NC_000001.11,172144535,172144644,minus,1,610720
9606,Homo sapiens,10645,0,live,CAMKK2,"CAMKK, CAMKKB",calcium/calmodulin dependent protein kinase kinase 2,"calcium/calmodulin-dependent protein kinase kinase 2|CAMKK beta protein|caM-KK 2|caM-KK beta|caM-kinase kinase 2|caM-kinase kinase beta|calcium/calmodulin-dependent protein kinase beta|calcium/calmodulin-dependent protein kinase kinase 2, beta",12q24.31,12,NC_000012.12,121237692,121298308,minus,20,615002
9606,Homo sapiens,984,0,live,CDK11B,"CDC2L1, CDK11, CDK11-p110, CDK11-p46, CDK11-p58, CLK-1, PITSLREA, PK58, p58, p58CDC2L1, p58CLK-1",cyclin dependent kinase 11B,cyclin-dependent kinase 11B|CDC-related protein kinase p58|PITSLRE serine/threonine-protein kinase CDC2L1|cell division cycle 2-like 1 (PITSLRE proteins)|cell division protein kinase 11B|galactosyltransferase-associated protein kinase p58/GTA|p58 CLK-1,1p36.33,1,NC_000001.11,1635225,1659619,minus,22,176873
9606,Homo sapiens,3110,0,live,MNX1,"HB9, HLXB9, HOXHB9, SCRA1",motor neuron and pancreas homeobox 1,motor neuron and pancreas homeobox protein 1|homeobox HB9|homeobox protein HB9,7q36.3,7,NC_000007.14,157004853,157010663,minus,4,142994
9606,Homo sapiens,4232,0,live,MEST,PEG1,mesoderm specific transcript,mesoderm-specific transcript homolog protein|paternally-expressed gene 1 protein,7q32.2,7,NC_000007.14,130486175,130506465,plus,15,601029
9606,Homo sapiens,442918,0,live,MIR373,"MIRN373, hsa-mir-373, miRNA373, mir-373",microRNA 373,,19q13.42,19,NC_000019.10,53788705,53788773,plus,1,611954
9606,Homo sapiens,7764,0,live,ZNF217,ZABC1,zinc finger protein 217,zinc finger protein 217,20q13.2,20,NC_000020.11,53567065,53608969,minus,13,602967
9606,Homo sapiens,7320,0,live,UBE2B,"E2-17kDa, HHR6B, HR6B, RAD6B, UBC2",ubiquitin conjugating enzyme E2 B,ubiquitin-conjugating enzyme E2 B|E2 protein|E2 ubiquitin-conjugating enzyme B|RAD6 homolog B|ubiquitin carrier protein B|ubiquitin conjugating enzyme E2B|ubiquitin-conjugating enzyme E2-17 kDa|ubiquitin-conjugating enzyme E2B (RAD6 homolog)|ubiquitin-protein ligase B,5q31.1,5,NC_000005.10,134371569,134392108,plus,6,179095
9606,Homo sapiens,5720,0,live,PSME1,"HEL-S-129m, IFI5111, PA28A, PA28alpha, REGalpha",proteasome activator subunit 1,"proteasome activator complex subunit 1|11S regulator complex subunit alpha|29-kD MCP activator subunit|IGUP I-5111|activator of multicatalytic protease subunit 1|epididymis secretory sperm binding protein Li 129m|interferon gamma up-regulated I-5111 protein|interferon-gamma IEF SSP 5111|interferon-gamma-inducible protein 5111|proteasome (prosome, macropain) activator subunit 1 (PA28 alpha)",14q12,14,NC_000014.9,24136158,24138967,plus,11,600654
9606,Homo sapiens,406966,0,live,MIR191,"MIRN191, miR-191",microRNA 191,hsa-mir-191,3p21.31,3,NC_000003.12,49020618,49020709,minus,1,615150
9606,Homo sapiens,83700,0,live,JAM3,"JAM-2, JAM-3, JAM-C, JAMC",junctional adhesion molecule 3,junctional adhesion molecule C,11q25,11,NC_000011.10,134068925,134152001,plus,9,606871
9606,Homo sapiens,6405,0,live,SEMA3F,"SEMA-IV, SEMA4, SEMAK",semaphorin 3F,"semaphorin-3F|sema domain, immunoglobulin domain (Ig), short basic domain, secreted, (semaphorin) 3F|sema domain, immunoglobulin domain (Ig), short basic domain, secreted, 3F|semaphorin III/F|semaphorin IV",3p21.31,3,NC_000003.12,50155058,50189075,plus,23,601124
9606,Homo sapiens,406960,0,live,MIR184,"EDICT, MIRN184, miR-184",microRNA 184,hsa-mir-184,15q25.1,15,NC_000015.10,79209788,79209871,plus,1,613146
9606,Homo sapiens,4905,0,live,NSF,"SEC18, SKD2","N-ethylmaleimide sensitive factor, vesicle fusing ATPase",vesicle-fusing ATPase|N-ethylmaleimide-sensitive factor-like protein|N-ethylmaleimide-sensitive fusion protein|NEM-sensitive fusion protein|epididymis secretory sperm binding protein|vesicular-fusion protein NSF,17q21.31,17,NC_000017.11,46590669,46757464,plus,21,601633
9606,Homo sapiens,2797,0,live,GNRH2,"GnRH-II, LH-RHII",gonadotropin releasing hormone 2,progonadoliberin-2|GnRH-associated peptide 2|GnRH-associated peptide II|Gonadoliberin II|Gonadoliberin-2|luliberin II|luteinizing hormone-releasing hormone II|progonadoliberin II,20p13,20,NC_000020.11,3039061,3045896,plus,5,602352
9606,Homo sapiens,10803,0,live,CCR9,"CC-CKR-9, CDw199, GPR-9-6, GPR28",C-C motif chemokine receptor 9,C-C chemokine receptor type 9|G protein-coupled receptor 28|chemokine (C-C motif) receptor 9,3p21.31,3,NC_000003.12,45886504,45903177,plus,5,604738
9606,Homo sapiens,7301,0,live,TYRO3,"BYK, Dtk, Etk-2, RSE, Rek, Sky, Tif",TYRO3 protein tyrosine kinase,tyrosine-protein kinase receptor TYRO3|tyrosine-protein kinase DTK|tyrosine-protein kinase RSE|tyrosine-protein kinase SKY|tyrosine-protein kinase TIF|tyrosine-protein kinase byk,15q15.1,15,NC_000015.10,41559212,41583589,plus,21,600341
9606,Homo sapiens,8913,0,live,CACNA1G,"Ca(V)T.1, Cav3.1, NBR13, SCA42, SCA42ND",calcium voltage-gated channel subunit alpha1 G,"voltage-dependent T-type calcium channel subunit alpha-1G|calcium channel, voltage-dependent, T type, alpha 1G subunit|cav3.1c|voltage-dependent T-type calcium channel alpha 1G subunit|voltage-dependent calcium channel alpha 1G subunit|voltage-gated calcium channel subunit alpha Cav3.1",17q21.33,17,NC_000017.11,50560715,50629625,plus,38,604065
9606,Homo sapiens,64798,0,live,DEPTOR,"DEP.6, DEPDC6",DEP domain containing MTOR interacting protein,DEP domain-containing mTOR-interacting protein|DEP domain containing 6|DEP domain-containing protein 6,8q24.12,8,NC_000008.11,119873655,120050918,plus,9,612974
9606,Homo sapiens,3310,0,live,HSPA6,HSP70B',heat shock protein family A (Hsp70) member 6,heat shock 70 kDa protein 6|epididymis secretory sperm binding protein|heat shock 70 kDa protein B'|heat shock 70kD protein 6 (HSP70B')|heat shock 70kDa protein 6 (HSP70B'),1q23.3,1,NC_000001.11,161524540,161526894,plus,1,140555
9606,Homo sapiens,311,0,live,ANXA11,"ALS23, ANX11, CAP-50, CAP50",annexin A11,annexin A11|56 kDa autoantigen|annexin XI|annexin-11|calcyclin-associated annexin 50|epididymis secretory sperm binding protein,10q22.3,10,NC_000010.11,80150889,80205808,minus,20,602572
9606,Homo sapiens,9844,0,live,ELMO1,"CED-12, CED12, ELMO-1",engulfment and cell motility 1,engulfment and cell motility protein 1|ced-12 homolog 1,7p14.2-p14.1,7,NC_000007.14,36852906,37449326,minus,29,606420
9606,Homo sapiens,55135,0,live,WRAP53,"DKCB3, TCAB1, WDR79",WD repeat containing antisense to TP53,telomerase Cajal body protein 1|WD repeat-containing protein 79|WD repeat-containing protein WRAP53|WD40 protein Wrap53|WD40 repeat-containing protein antisense to TP53|WD40 repeat-containing protein encoding RNA antisense to p53|WRAP53beta,17p13.1,17,NC_000017.11,7686071,7703502,plus,13,612661
9606,Homo sapiens,1032,0,live,CDKN2D,"INK4D, p19, p19-INK4D",cyclin dependent kinase inhibitor 2D,"cyclin-dependent kinase 4 inhibitor D|CDK inhibitor p19INK4d|cell cycle inhibitor, Nur77 associating protein|cyclin-dependent kinase 4 inhibitor D p19|cyclin-dependent kinase inhibitor 2D (p19, inhibits CDK4)|inhibitor of cyclin-dependent kinase 4d",19p13.2,19,NC_000019.10,10566460,10568979,minus,2,600927
9606,Homo sapiens,81607,0,live,NECTIN4,"EDSS1, LNIR, PRR4, PVRL4, nectin-4",nectin cell adhesion molecule 4,nectin-4|Ig superfamily receptor LNIR|nectin 4|poliovirus receptor-related 4|poliovirus receptor-related protein 4,1q23.3,1,NC_000001.11,161070998,161089566,minus,9,609607
9606,Homo sapiens,55553,0,live,SOX6,"HSSOX6, SOXD",SRY-box transcription factor 6,transcription factor SOX-6|SRY (sex determining region Y)-box 6|SRY-box 6|SRY-box containing gene 6,11p15.2,11,NC_000011.10,15966449,16738477,minus,22,607257
9606,Homo sapiens,9820,0,live,CUL7,"3M1, CUL-7, KIAA0076, dJ20C7.5",cullin 7,cullin-7,6p21.1,6,NC_000006.12,43037617,43053945,minus,27,609577
9606,Homo sapiens,11047,0,live,ADRM1,"ARM-1, ARM1, GP110",adhesion regulating molecule 1,"proteasomal ubiquitin receptor ADRM1|110 kDa cell membrane glycoprotein|M(r) 110,000 surface antigen|proteasome regulatory particle non-ATPase 13|rpn13 homolog",20q13.33,20,NC_000020.11,62302061,62308862,plus,10,610650
9606,Homo sapiens,2822,0,live,GPLD1,"GPIPLD, GPIPLDM, PIGPLD, PIGPLD1, PLD",glycosylphosphatidylinositol specific phospholipase D1,phosphatidylinositol-glycan-specific phospholipase D|GPI-PLD|GPI-specific phospholipase D|PI-G PLD|glycoprotein phospholipase D,6p22.3,6,NC_000006.12,24423969,24495232,minus,26,602515
9606,Homo sapiens,10568,0,live,SLC34A2,"NAPI-3B, NAPI-IIb, NPTIIb, PULAM",solute carrier family 34 member 2,"sodium-dependent phosphate transport protein 2B|sodium/phosphate cotransporter 2B|solute carrier family 34 (sodium phosphate), member 2|solute carrier family 34 (type II sodium/phosphate cotransporter), member 2|type II sodium-dependent phosphate transporter 3b",4p15.2,4,NC_000004.12,25655851,25678748,plus,14,604217
9606,Homo sapiens,11279,0,live,KLF8,"BKLF3, ZNF741",Kruppel like factor 8,Krueppel-like factor 8|basic krueppel-like factor 3|basic kruppel-like factor 3|zinc finger protein 741,Xp11.21,X,NC_000023.11,55908123,56291531,plus,7,300286
9606,Homo sapiens,817,0,live,CAMK2D,CAMKD,calcium/calmodulin dependent protein kinase II delta,calcium/calmodulin-dependent protein kinase type II subunit delta|CaM kinase II delta subunit|CaM-kinase II delta chain|CaMK-II delta subunit|calcium/calmodulin-dependent protein kinase (CaM kinase) II delta|calcium/calmodulin-dependent protein kinase type II delta chain,4q26,4,NC_000004.12,113451032,113762177,minus,26,607708
9606,Homo sapiens,619554,0,live,MIR486-1,"MIR486, MIRN486, hsa-mir-486, hsa-mir-486-1, mir-486-1",microRNA 486-1,microRNA 486,8p11.21,8,NC_000008.11,41660441,41660508,minus,1,
9606,Homo sapiens,9958,0,live,USP15,"UNPH-2, UNPH4",ubiquitin specific peptidase 15,ubiquitin carboxyl-terminal hydrolase 15|deubiquitinating enzyme 15|ubiquitin thioesterase 15|ubiquitin thiolesterase 15|ubiquitin-specific-processing protease 15,12q14.1,12,NC_000012.12,62260340,62416389,plus,27,604731
9606,Homo sapiens,8242,0,live,KDM5C,"DXS1272E, JARID1C, MRX13, MRXJ, MRXSCJ, MRXSJ, SMCX, XE169",lysine demethylase 5C,"lysine-specific demethylase 5C|JmjC domain-containing protein SMCX|Jumonji, AT rich interactive domain 1C (RBP2-like)|Jumonji/ARID domain-containing protein 1C|Smcx homolog, X chromosome|Smcy homolog, X-linked|histone demethylase JARID1C|lysine (K)-specific demethylase 5C",Xp11.22,X,NC_000023.11,53176277,53225422,minus,29,314690
9606,Homo sapiens,494335,0,live,MIR423,"MIRN423, hsa-mir-423, mir-423",microRNA 423,,17q11.2,17,NC_000017.11,30117079,30117172,plus,1,
9606,Homo sapiens,81848,0,live,SPRY4,HH17,sprouty RTK signaling antagonist 4,protein sprouty homolog 4|sprouty homolog 4,5q31.3,5,NC_000005.10,142310435,142325021,minus,5,607984
9606,Homo sapiens,8440,0,live,NCK2,"GRB4, NCKbeta",NCK adaptor protein 2,"cytoplasmic protein NCK2|SH2/SH3 adaptor protein NCK-beta|growth factor receptor-bound protein 4|noncatalytic region of tyrosine kinase, beta",2q12.2,2,NC_000002.12,105744649,105894274,plus,9,604930
9606,Homo sapiens,284654,0,live,RSPO1,"CRISTIN3, RSPO",R-spondin 1,R-spondin-1|R-spondin homolog|roof plate-specific spondin-1,1p34.3,1,NC_000001.11,37611350,37634906,minus,8,609595
9606,Homo sapiens,127,0,live,ADH4,"ADH-2, HEL-S-4","alcohol dehydrogenase 4 (class II), pi polypeptide",all-trans-retinol dehydrogenase [NAD()] ADH4|alcohol dehydrogenase class II pi chain|aldehyde reductase|epididymis secretory protein Li 4,4q23,4,NC_000004.12,99123657,99144298,minus,10,103740
9606,Homo sapiens,5987,0,live,TRIM27,"RFP, RNF76",tripartite motif containing 27,zinc finger protein RFP|RFP transforming protein|RING finger protein 76|RING-type E3 ubiquitin transferase TRIM27|ret finger protein|tripartite motif protein TRIM27|tripartite motif-containing protein 27,6p22.1,6,NC_000006.12,28903002,28923985,minus,8,602165
9606,Homo sapiens,826,0,live,CAPNS1,"CALPAIN4, CANP, CANPS, CAPN4, CDPS, CSS1",calpain small subunit 1,"calpain small subunit 1|CANP small subunit|calcium-activated neutral proteinase small subunit|calcium-dependent protease small subunit 1|calcium-dependent protease, small subunit|calpain 4, small subunit (30K)|calpain regulatory subunit|calpain, small polypeptide|epididymis secretory sperm binding protein",19q13.12,19,NC_000019.10,36140066,36150353,plus,13,114170
9606,Homo sapiens,7007,0,live,TECTA,"DFNA12, DFNA8, DFNB21",tectorin alpha,alpha-tectorin,11q23.3,11,NC_000011.10,121102666,121190806,plus,23,602574
9606,Homo sapiens,1825,0,live,DSC3,"CDHF3, DSC, DSC1, DSC2, DSC4, HT-CP",desmocollin 3,desmocollin-3|cadherin family member 3|desmocollin-4,18q12.1,18,NC_000018.10,30989365,31042815,minus,17,600271
